{
  "feature": "verify-fix-sweep",
  "createdAt": "2026-08-11T00:20:24Z",
  "pipelineStatus": "active",
  "stages": {
    "forge-1-prd": {
      "status": "complete",
      "startedAt": "2026-08-11T00:20:24Z",
      "artifacts": [
        "PRD.md"
      ],
      "completedAt": "2026-08-11T00:21:43Z",
      "version": 1,
      "basedOnVersions": {},
      "commitHash": "960b9ab8013c2a5e02db5cf6a760cccb5c96b0ef"
    },
    "forge-verify-prd": {
      "status": "passed",
      "verifiedAt": "2026-08-11T00:47:03Z",
      "verifiedStageVersion": 1,
      "commitHash": "906a361a607337026730ae974cd0ba61b529efe1"
    },
    "forge-2-tech": {
      "status": "complete",
      "startedAt": "2026-08-11T01:20:01Z",
      "artifacts": [
        "tech-spec.md"
      ],
      "completedAt": "2026-08-11T02:41:27Z",
      "version": 1,
      "basedOnVersions": {
        "forge-1-prd": 1
      },
      "commitHash": null
    }
  },
  "currentStage": "forge-2-tech",
  "updatedAt": "2026-08-11T02:41:27Z",
  "branch": "forge/verify-fix-sweep"
}
