{
  "feature": "stage-exit-coverage",
  "createdAt": "2026-07-30T03:44:44Z",
  "pipelineStatus": "active",
  "stages": {
    "forge-1-prd": {
      "status": "complete",
      "startedAt": "2026-07-30T04:22:51Z",
      "completedAt": "2026-07-30T04:23:13Z",
      "version": 2,
      "basedOnVersions": {},
      "artifacts": [
        "PRD.md"
      ],
      "commitHash": "784c826a186eb5b5234758811c6dac8386f1996c"
    },
    "forge-2-tech": {
      "status": "complete",
      "startedAt": "2026-07-30T04:23:37Z",
      "artifacts": [
        "tech-spec.md"
      ],
      "completedAt": "2026-07-30T04:24:44Z",
      "version": 2,
      "basedOnVersions": {
        "forge-1-prd": 2
      },
      "commitHash": "5e4dc021c5b7d9dff588044a065e5ee0eb7368ea"
    },
    "forge-verify-tech": {
      "status": "passed",
      "findingsFile": ".verification/VERIFY-tech-2026-07-30.md",
      "findingsCount": 0,
      "verifiedAt": "2026-07-30T04:55:17Z",
      "verifiedStageVersion": 2,
      "fixedAt": "2026-07-30T04:53:11Z",
      "commitHash": "50225d78035ea44392fb0551bd8c192bd40344e1"
    },
    "forge-3-specs": {
      "status": "complete",
      "startedAt": "2026-07-30T05:06:43Z",
      "artifacts": [
        "00-core-definitions.md",
        "01-architecture-layout.md",
        "02-stage-exit-routing.md",
        "03-verification-state.md",
        "04-skill-integration.md",
        "05-config-and-distribution.md",
        "06-compliance-and-coverage.md",
        "07-testing-strategy.md",
        "TRACEABILITY.md"
      ],
      "completedAt": "2026-07-30T05:26:26Z",
      "version": 1,
      "basedOnVersions": {
        "forge-1-prd": 2,
        "forge-2-tech": 2
      },
      "commitHash": "3563d4dfc703a5b4b61be850750e93421d168acf"
    },
    "forge-verify-specs": {
      "status": "findings-reported",
      "findingsFile": ".verification/VERIFY-specs-2026-07-30-round2.md",
      "findingsCount": 10,
      "verifiedAt": "2026-07-30T14:15:15Z",
      "verifiedStageVersion": 1,
      "commitHash": "e2959c1507054eb0fa9e78bbf117dca4ad981ae2",
      "partiallyAppliedAt": "2026-07-30T14:37:56Z"
    }
  },
  "currentStage": "forge-3-specs",
  "updatedAt": "2026-07-30T14:37:56Z",
  "branch": "forge/stage-exit-coverage"
}
