{
  "feature": "verify-test-debt",
  "createdAt": "2026-08-03T13:39:30Z",
  "pipelineStatus": "active",
  "stages": {
    "forge-1-prd": {
      "status": "complete",
      "startedAt": "2026-08-03T13:39:30Z",
      "completedAt": "2026-08-03T17:20:03Z",
      "version": 2,
      "basedOnVersions": {},
      "artifacts": [
        "PRD.md"
      ],
      "commitHash": "54a34078b9b404c1b2dd4c0eda968b325baadb83"
    },
    "forge-verify-prd": {
      "status": "passed",
      "findingsFile": ".verification/VERIFY-tech-v2confirm-2026-08-03.md",
      "findingsCount": 11,
      "verifiedAt": "2026-08-03T18:00:05Z",
      "verifiedStageVersion": 2,
      "commitHash": "e1603f1bb2a39193dd59910f5a81c4e2420d0694"
    },
    "forge-2-tech": {
      "status": "complete",
      "startedAt": "2026-08-03T14:10:51Z",
      "completedAt": "2026-08-03T17:20:08Z",
      "version": 2,
      "basedOnVersions": {
        "forge-1-prd": 2
      },
      "artifacts": [
        "tech-spec.md"
      ],
      "commitHash": "54a34078b9b404c1b2dd4c0eda968b325baadb83"
    },
    "forge-verify-tech": {
      "status": "passed",
      "findingsFile": ".verification/VERIFY-tech-v2confirm-2026-08-03.md",
      "findingsCount": 11,
      "verifiedAt": "2026-08-03T17:59:36Z",
      "verifiedStageVersion": 2,
      "commitHash": "ffa2fa79caa4128fef0367b0e32e0f0dfd77a82d"
    },
    "forge-3-specs": {
      "status": "complete",
      "startedAt": "2026-08-03T18:21:26Z",
      "artifacts": [
        "00-core-definitions.md",
        "01-architecture-layout.md",
        "02-canon-and-prose-guard.md",
        "03-machinery-trim.md",
        "04-production-validations.md",
        "05-coverage-backfill.md",
        "06-brittleness-batch.md",
        "07-testing-strategy.md",
        "TRACEABILITY.md"
      ],
      "completedAt": "2026-08-03T19:27:01Z",
      "version": 1,
      "basedOnVersions": {
        "forge-1-prd": 2,
        "forge-2-tech": 2
      },
      "commitHash": "e59a41b329e0475faaf84214f5f3f46b51c7136a"
    },
    "forge-verify-specs": {
      "status": "findings-reported",
      "findingsFile": ".verification/VERIFY-specs-v1-2026-08-03.md",
      "findingsCount": 11,
      "verifiedAt": "2026-08-03T20:25:38Z",
      "verifiedStageVersion": 1,
      "commitHash": "561ad035f605376ec8629153a3293183723eb9c2"
    }
  },
  "currentStage": "forge-3-specs",
  "updatedAt": "2026-08-03T20:25:50Z",
  "branch": "forge/verify-test-debt",
  "notes": "PRD amendment needed: research superseded three figures. REQ-BRIT-04 exact-stderr roster is 5 sites/11 comparisons across 2 files (not ~15); REQ-BRIT-07 hash-matrix family is 4 sites (not 5); REQ-COV-03's resolver_line_identical IS asserted via all(criteria.values()) at run-compliance-eval.py:1883 — the real gap is a missing prelude key-set pin. Same figures appear in PRD sec 8 Success Criteria. Corrected rosters live in tech-spec.md."
}
